<?xml version="1.0" encoding="UTF-8" standalone="yes"?>
<!DOCTYPE repositorios SYSTEM "repositorio.dtd">
<repositorios>
    <repositorio>
        <nombre>TareasJava</nombre>
        <categoria>Programacion</categoria>

        <software_list>
            <file identificador="F111">
                <nombre>B_JAA1.java</nombre>
                <etiqueta>Primer archivo</etiqueta>
                <tipo cual="free"/>
                <size>120MB</size>
                <checksum is="Y"/>
                <fecha_subida>24/10/2023</fecha_subida>

                <desarrolladores>
                    <desarrollador id="D6">
                        <nombre>Jose</nombre>
                        <apellido>Alba</apellido>
                        <ocupacion cual="interno"/>
                    </desarrollador>
                </desarrolladores>
            </file>

            <file identificador="F112">
                <nombre>calculadora.java</nombre>
                <tipo cual="free"/>
                <size>100MB</size>
                <checksum is="Y"/>
                <fecha_subida>31/10/2023</fecha_subida>

                <desarrolladores>
                <desarrollador id="D7">
                    <nombre>Jes√∫s</nombre>
                    <apellido>Cereceda</apellido>
                    <ocupacion cual="freelancer"/>
                </desarrollador>
                </desarrolladores>
            </file>
        </software_list>
    </repositorio>
</repositorios>